id_fuente,nombre,entidad,portal,url_dataset,url_recurso,url_descarga,resource_id,formato,granularidad,uso,limitacion
aporte_predial,Recaudo Aporte Voluntario Impuesto Predial 2006-2023,Secretaría Distrital de Hacienda,Portal de Datos Abiertos Bogotá,https://datosabiertos.bogota.gov.co/dataset/recaudo-aporte-voluntario-impuesto-predial,https://datosabiertos.bogota.gov.co/dataset/recaudo-aporte-voluntario-impuesto-predial/resource/10a5f103-ac7c-42f9-9096-05561839fa3e,https://datosabiertos.bogota.gov.co/dataset/e03353e3-8c8f-4b9f-a342-999af007e9a8/resource/10a5f103-ac7c-42f9-9096-05561839fa3e/download/18.-recaudo-aporte-voluntario-impuesto-predial_2006_2023.csv,10a5f103-ac7c-42f9-9096-05561839fa3e,CSV,año - impuesto - estrato,"Contexto del aporte voluntario predial: evolución, aportantes y estrato.",No incluye localidad ni llave pública para asociar directamente cada aporte a proyectos territoriales.
cumplimiento_predial,Cumplimiento Impuesto Predial 2007-2023. Bogotá D.C.,Secretaría Distrital de Hacienda,Portal de Datos Abiertos Bogotá,https://datosabiertos.bogota.gov.co/dataset/cumplimiento-impuesto-predial-2007-2017,https://datosabiertos.bogota.gov.co/dataset/cumplimiento-impuesto-predial-2007-2017/resource/2dada77d-7355-4cbf-b944-89b8d87bb65b,https://datosabiertos.bogota.gov.co/dataset/092ad69a-7d04-4195-b203-0fd70af52412/resource/2dada77d-7355-4cbf-b944-89b8d87bb65b/download/15.-cumplimiento-impuesto-predial_2007_2023.csv,2dada77d-7355-4cbf-b944-89b8d87bb65b,CSV,año gravable - localidad - UPZ - barrio - estrato - destino,"Indicadores territoriales de cumplimiento, oportunidad, morosidad y pago predial.","Es registro administrativo agregado; no mide confianza, motivación ni comportamiento individual."
em2021_completa,Encuesta Multipropósito 2021,Secretaría Distrital de Planeación,Portal de Datos Abiertos Bogotá,https://datosabiertos.bogota.gov.co/dataset/encuesta-multiproposito-2021-sdp,https://datosabiertos.bogota.gov.co/dataset/encuesta-multiproposito-2021-sdp/resource/b3fd892e-b9f9-4f34-ac22-6cc50612eac9,https://datosabiertos.bogota.gov.co/dataset/8ac12a95-1415-4812-b343-f07f90608014/resource/b3fd892e-b9f9-4f34-ac22-6cc50612eac9/download/em2021.csv,b3fd892e-b9f9-4f34-ac22-6cc50612eac9,CSV,hogar/persona; agregable territorialmente si las columnas de localidad están disponibles,"Variables de percepción, participación, satisfacción y entorno para robustecer el ITCC.",Archivo grande; se incorpora de forma opcional para evitar bloqueos por tiempo o memoria.
em2021_adicionales,Variables Adicionales Encuesta Multipropósito 2021,Secretaría Distrital de Planeación,Portal de Datos Abiertos Bogotá,https://datosabiertos.bogota.gov.co/dataset/encuesta-multiproposito-2021-sdp,https://datosabiertos.bogota.gov.co/dataset/encuesta-multiproposito-2021-sdp/resource/ba44798f-5257-4c5c-8a57-0966da1bb4fa,https://datosabiertos.bogota.gov.co/dataset/8ac12a95-1415-4812-b343-f07f90608014/resource/ba44798f-5257-4c5c-8a57-0966da1bb4fa/download/20240430_variables_adicionales_2021.csv,ba44798f-5257-4c5c-8a57-0966da1bb4fa,CSV,hogar/persona con variables adicionales e indicadores compuestos,"Proxies de condiciones sociales, vivienda, pobreza, ingreso y acceso a servicios para ITCC de respaldo.",No contiene por sí sola todas las variables subjetivas de confianza; sirve como respaldo o componente social.
pp_avance,Estado de avance propuestas priorizadas Bogotá D.C.,Secretaría Distrital de Planeación,Portal de Datos Abiertos Bogotá,https://datosabiertos.bogota.gov.co/dataset/presupuestos-participativos-bogota-dc,https://datosabiertos.bogota.gov.co/dataset/presupuestos-participativos-bogota-dc/resource/99d01780-ee33-40ff-9f09-2ecd62d9b1d9,https://datosabiertos.bogota.gov.co/dataset/3ded79df-ec9e-4f92-a949-ca8b1ae12d7d/resource/99d01780-ee33-40ff-9f09-2ecd62d9b1d9/download/datos_abiertos_avance_propuestas_priorizadas_pp_31-03-2026.ods,99d01780-ee33-40ff-9f09-2ecd62d9b1d9,ODS,vigencia - localidad - sector - proyecto - propuesta,Proyectos priorizados por ciudadanía y estado de avance; evidencia de participación/proyectos visibles.,No prueba que los proyectos hayan sido financiados por aporte voluntario. Sirve para trazabilidad pública de proyectos territoriales.
pp_presupuesto,Presupuesto comprometido por meta proyecto y propuestas financiadas Bogotá D.C.,Secretaría Distrital de Planeación,Portal de Datos Abiertos Bogotá,https://datosabiertos.bogota.gov.co/dataset/presupuestos-participativos-bogota-dc,https://datosabiertos.bogota.gov.co/dataset/presupuestos-participativos-bogota-dc/resource/7c5d5813-3621-47d7-92bc-fb46957988cb,https://datosabiertos.bogota.gov.co/dataset/3ded79df-ec9e-4f92-a949-ca8b1ae12d7d/resource/7c5d5813-3621-47d7-92bc-fb46957988cb/download/datos_abiertos_presupuesto_comprometido_xmeta_pp_31-03-2026.ods,7c5d5813-3621-47d7-92bc-fb46957988cb,ODS,vigencia - localidad - sector - proyecto - compromiso presupuestal,Presupuesto asociado a propuestas financiadas de presupuestos participativos.,"Se interpreta como proyecto territorial visible, no como destinación directa del aporte voluntario."
tarjeta_metro,Reconocimiento a contribuyentes con aporte voluntario: tarjeta conmemorativa Metro,Portal Bogotá / Secretaría Distrital de Hacienda,Bogotá.gov.co,https://bogota.gov.co/mi-ciudad/hacienda/bogota-reconoce-quienes-hicieron-aporte-voluntario-en-impuestos,https://bogota.gov.co/mi-ciudad/hacienda/bogota-reconoce-quienes-hicieron-aporte-voluntario-en-impuestos,No aplica; fuente documental oficial de contexto,No aplica,Nota web oficial,distrital - contribuyentes por impuesto con corte informado,Antecedente institucional de reconocimiento ciudadano asociado al aporte voluntario.,No se usa para inferencia estadística; contextualiza la recomendación de reconocimiento inteligente.
